<?xml version="1.0" encoding="UTF-8" ?>
<class name="CSGCylinder3D" inherits="CSGPrimitive3D" xmlns:xsi="http://www.w3.org/2001/XMLSchema-instance" xsi:noNamespaceSchemaLocation="../../../doc/class.xsd">
	<brief_description>
		A CSG Cylinder shape.
	</brief_description>
	<description>
		This node allows you to create a cylinder (or cone) for use with the CSG system.
		[b]Note:[/b] CSG nodes are intended to be used for level prototyping. Creating CSG nodes has a significant CPU cost compared to creating a [MeshInstance3D] with a [PrimitiveMesh]. Moving a CSG node within another CSG node also has a significant CPU cost, so it should be avoided during gameplay.
	</description>
	<tutorials>
		<link title="Prototyping levels with CSG">$DOCS_URL/tutorials/3d/csg_tools.html</link>
	</tutorials>
	<methods>
		<method name="get_radius" qualifiers="const">
			<return type="float" />
			<description>
			</description>
		</method>
		<method name="set_radius">
			<return type="void" />
			<param index="0" name="radius" type="float" />
			<description>
			</description>
		</method>
	</methods>
	<members>
		<member name="bottom_radius" type="float" setter="set_bottom_radius" getter="get_bottom_radius" default="0.5">
			The radius of the bottom face of the cylinder. If set to [code]0.0[/code], the cylinder will be a cone.
		</member>
		<member name="cone" type="bool" setter="set_cone" getter="is_cone" deprecated="Set [member top_radius] to [code]0.0[/code] instead.">
			If [code]true[/code], the cylinder will be a cone, with the top radius set to [code]0.0[/code].
		</member>
		<member name="height" type="float" setter="set_height" getter="get_height" default="2.0">
			The height of the cylinder.
		</member>
		<member name="material" type="Material" setter="set_material" getter="get_material">
			The material used to render the cylinder.
		</member>
		<member name="radius" type="float" setter="set_top_radius" getter="get_top_radius" deprecated="Use [member top_radius] and [member bottom_radius] instead.">
			The radius of the cylinder.
		</member>
		<member name="sides" type="int" setter="set_sides" getter="get_sides" default="8">
			The number of sides of the cylinder. The higher this number, the more detail there will be in the cylinder.
		</member>
		<member name="smooth_faces" type="bool" setter="set_smooth_faces" getter="get_smooth_faces" default="true">
			If [code]true[/code] the normals of the cylinder are set to give a smooth effect, making the cylinder seem rounded. If [code]false[/code], the cylinder will have a flat shaded look.
		</member>
		<member name="top_radius" type="float" setter="set_top_radius" getter="get_top_radius" default="0.5">
			The radius of the top face of the cylinder. If set to [code]0.0[/code], the cylinder will be a cone.
		</member>
	</members>
</class>
